defined_class	defined_class_name	new_entity	new_entity_label	parent_entity	parent_entity_label	exact_syn	defined_class_definition	dbxref	def_dbxref	depictedBy	depicted_by	image_comment	comment	has_obo_namespace	created_by	part_of	part_of_label	contained_in	contained_in_label	develops_from	develops_from_label	existence_starts_during_or_after	existence_starts_during_or_after_label	existence_ends_during_or_before	existence_ends_during_or_before_label	existence_overlaps	existence_overlaps_label	immediately_deep_to	immediately_deep_to_label	immediately_superficial_to	immediately_superficial_to_label	adjacent_to	adjacent_to_label	anterior_to	anterior_to_label	posterior_to	posterior_to_label	participates_in	participates_in_label	produced_by	produced_by_label	produces_this	produces_this_label	specific_to	specific_to_label	results_in 	results_ label 
PLANA:0000459	optic chiasm	PLANA:0000459	optic chiasm	PLANA:0000543	neuron projection bundle	chiasm|chiasma|chiasma nervorum opticorum|chiasma opticum|decussation of optic nerve fibers|optic chiasm (Rufus of Ephesus)|optic chiasma|optic chiasmata	A decussation of the diencephalon where the fibers of the optic nerve cross	AAO:0010622|BAMS:DC|BAMS:OC|BAMS:och|BAMS:ox|BM:Tel-OCX|C90609|DHBA:10644|DMBA:17783|EHDAA2:0001302|EHDAA:10227|EMAPA:17603|FMA:62045|GAID:832|HBA:9310|MA:0001098|MBA:117|MESH:D009897|Optic:chiasm|PMID:15866156|PMID:16033796|PMID:17553481|PMID:17905225|PMID:18202849|PMID:18466009|PMID:19048075|PMID:19211673|PMID:21282632|PMID:22339734|PMID:22445864|PMID:25356635|PMID:25493551|PMID:26618653|PMID:27800171|PMID:28495872|PMID:30194301|PMID:30962434|TAO:0000556|UBERON:0000959|UMLS:C0029126|VHOG:0000190|XAO:0004071|ZFA:0000556|birnlex:1416|http://braininfo.rprc.washington.edu/centraldirectory.aspx?ID=459|http://linkedlifedata.com/resource/umls/id/C0029126|http://www.snomedbrowser.com/Codes/Details/244453006						Planarian_Anatomy	https://orcid.org/0000-0003-2569-1939 | https://orcid.org/0000-0002-7535-4735	PLANA:0000124|PLANA:0000025	visual system|nervous system	PLANA:0000418|PLANA:0000140	head|anterior region							PLANA:0000214|PLANA:0004503|PLANA:0004504	juvenile|adult hermaphrodite|asexual adult																				
PLANA:0000460	anterior commissure	PLANA:0000460	anterior commissure	PLANA:0000494	brain commissure	anterior brain commissure 	A bundle of nerve fibers connecting the two cephalic ganglia.	UBERON:0000935						Planarian_Anatomy	https://orcid.org/0000-0003-2569-1939 | https://orcid.org/0000-0002-7535-4427	PLANA:0000044	cephalic ganglia 	PLANA:0000140|PLANA:0000418	anterior region|head							PLANA:0000214|PLANA:0004504|PLANA:0004503	juvenile|asexual adult|adult hermaphrodite																				
PLANA:0000461	lateral branch	PLANA:0000461	lateral branch	PLANA:0000113	tissue 	bilateral cephalic ganglia branch|brain branch|cephalic brain branch|cephalic branch|lateral brain branch	Nerve branches that extend from the lateral side of each cephalic ganglia lobe. Each lobe has nine lateral branches which terminate in sensory organs. Evidence suggests they play a role in chemosensation.	ISBN:9780070316607|PMID:12128224|PMID:18287199|PMID:18466009|PMID:20422023|PMID:21282632|PMID:21806978|PMID:24922054|PMID:25254346|PMID:27612384|PMID:29674431|PMID:30399335|PMID:4452894|PMID:9493832						Planarian_Anatomy	https://orcid.org/0000-0003-2569-1939 | https://orcid.org/0000-0002-7535-4651	PLANA:0000044	cephalic ganglia	PLANA:0000140|PLANA:0000418|PLANA:0000143	anterior region|head|ventral region							PLANA:0000214|PLANA:0004503|PLANA:0004504	juvenile|adult hermaphrodite|asexual adult																				
PLANA:0000462	sensory cell	PLANA:0000462	sensory cell	PLANA:0000119	terminally differentiated cell		A cell that performs a sensory function.	ISBN:9780070316607|PMID:17251262|PMID:17942485						Planarian_Anatomy	https://orcid.org/0000-0003-2569-1939 | https://orcid.org/0000-0002-7535-4874																																
PLANA:0000463	cholinergic neuron	PLANA:0000463	cholinergic neuron	PLANA:0000556 	neurosecretory neuron 	acetylcholinergic neuron	Neurons that express choline acetyltransferase.	PMID:20338223|PMID:21566185|PMID:23652002|PMID:23903188|PMID:24131630|PMID:24173799|PMID:24950970|PMID:25356635|PMID:26525673|PMID:27163480|PMID:27612382|PMID:27864883|PMID:28126842|PMID:28137894|PMID:29291981|PMID:30143032|PMID:30194301						Planarian_Anatomy	https://orcid.org/0000-0003-2569-1939 | https://orcid.org/0000-0002-7535-4486	PLANA:0000103	central nervous system									PLANA:0000214|PLANA:0004504|PLANA:0004503	juvenile|asexual adult|adult hermaphrodite																				
PLANA:0000464	GABAergic neuron	PLANA:0000464	GABAergic neuron	PLANA:0000556 	neurosecretory neuron 	GABA neuron|GABAergic cell|gabanergic neuron|inhibitory neuron	Neurons that express glutamine decarboxylase.	PMID:18440152|PMID:23903188|PMID:24131630|PMID:24173799|PMID:24922054|PMID:24950970|PMID:25356635|PMID:26525673|PMID:27864883|PMID:28216315|PMID:29291981|PMID:30194301|PMID:30485821						Planarian_Anatomy	https://orcid.org/0000-0003-2569-1939 | https://orcid.org/0000-0002-7535-4610	PLANA:0000103|PLANA:0000080	central nervous system|peripheral nervous system									PLANA:0004504|PLANA:0004503|PLANA:0000214	asexual adult|adult hermaphrodite|juvenile																				
PLANA:0000465	pharynx nerve plexus	PLANA:0000465	pharynx nerve plexus	PLANA:0000492	nerve plexus 	nerve ganglia of pharynx|neural plexus of the pharynx|pharyngeal nerve plexus|pharyngeal nerve ring|pharyngeal nervous system|pharyngeal neural plexus|pharynx nerve ring	Plexus of nerves located in the pharynx comprised of inner and outer wall rings.	PMID:16033796|PMID:17905225|PMID:20967238|PMID:23250205|PMID:23297191						Planarian_Anatomy	https://orcid.org/0000-0003-2569-1939 | https://orcid.org/0000-0002-7535-4780	PLANA:0000080|PLANA:0000016	peripheral nervous system|pharynx	PLANA:0000420	parapharyngeal region							PLANA:0000214|PLANA:0004504|PLANA:0004503	juvenile|asexual adult|adult hermaphrodite																				
PLANA:0000466	subepidermal nerve plexus	PLANA:0000466	subepidermal nerve plexus	PLANA:0000492	nerve plexus		Plexus of nerves located just between the epidermis and the body wall musculature.	PMID:27612384|doi:10.1002/jmor.1051550208						Planarian_Anatomy	https://orcid.org/0000-0003-2569-1939 | https://orcid.org/0000-0002-7535-4907	PLANA:0000080|PLANA:0004529	peripheral nervous system|integumental system	PLANA:0000421|PLANA:0000140|PLANA:0000143|PLANA:0000142|PLANA:0004527|PLANA:0000141|PLANA:0000420|PLANA:0000418|PLANA:0000419	tail|anterior region|ventral region|posterior region|copulatory region|dorsal region|parapharyngeal region|head|prepharyngeal region							PLANA:0004503|PLANA:0000214|PLANA:0004504	adult hermaphrodite|juvenile|asexual adult																				
PLANA:0000467	submuscular nerve plexus	PLANA:0000467	submuscular nerve plexus	PLANA:0000492	nerve plexus		Plexus of nerves that innervate the body wall musculature.							Planarian_Anatomy	https://orcid.org/0000-0003-2569-1939 | https://orcid.org/0000-0002-7535-4908	PLANA:0000080|PLANA:0000428	peripheral nervous system| musculature system	PLANA:0000140|PLANA:0004527|PLANA:0000421|PLANA:0000420|PLANA:0000143|PLANA:0000419|PLANA:0000142|PLANA:0000141|PLANA:0000418	anterior region|copulatory region|tail|parapharyngeal region|ventral region|prepharyngeal region|posterior region|dorsal region|head							PLANA:0000214|PLANA:0004504|PLANA:0004503	juvenile|asexual adult|adult hermaphrodite																				
PLANA:0000468	gastrodermal plexus	PLANA:0000468	gastrodermal plexus	PLANA:0000492	nerve plexus		A thin net of single nerve fibers located around the gut.	PMID:17999079|doi.org/10.1002/jmor.1051550208						Planarian_Anatomy	https://orcid.org/0000-0003-2569-1939 | https://orcid.org/0000-0002-7535-4616	PLANA:0000049|PLANA:0000080	digestive system|peripheral nervous system	PLANA:0000419|PLANA:0000421|PLANA:0000420|PLANA:0000140|PLANA:0004527|PLANA:0000418|PLANA:0000142	prepharyngeal region|tail|parapharyngeal region|anterior region|copulatory region|head|posterior region							PLANA:0000214|PLANA:0004503|PLANA:0004504	juvenile|adult hermaphrodite|asexual adult																				
PLANA:0000470	neuropil	PLANA:0000470	neuropil	PLANA:0000113	tissue	central neuropil|cephalic ganglia neuropil|neuropilus	A cluster of neurites that is part of a nervous system and forms a network of dendrites and axons where synapses are present and in which neuronal somata do not occur.	BTO:0005268|C12617|CALOHA:TS-2403|FBbt:00005139|FMA:261269|GAID:740|MESH:D019581|NIF:Subcellular:sao205380252|PMID:16033796|PMID:17553481|PMID:24173799|PMID:24950970|PMID:25356635|PMID:27612382|PMID:27612384|PMID:29291974|PMID:29291981|UBERON:0002606|UMLS:C0228081|birnlex:1142|http://en.wikipedia.org/wiki/Neuropil|http://linkedlifedata.com/resource/umls/id/C0228081|http://www.snomedbrowser.com/Codes/Details/67146008						Planarian_Anatomy	https://orcid.org/0000-0003-2569-1939 | https://orcid.org/0000-0002-7535-4716	PLANA:0000044	cephalic ganglia	PLANA:0000140|PLANA:0000143|PLANA:0000418	anterior region|ventral region|head							PLANA:0004504|PLANA:0000214|PLANA:0004503	asexual adult|juvenile|adult hermaphrodite																				
PLANA:0000472	pharynx outer epithelium	PLANA:0000472	pharynx outer epithelium	PLANA:0002023	ciliated epithelium	epithelial pharynx lining|outer pharyngeal epidermis|outer pharyngeal epithelium|outer pharynx epidermis|outer pharynx epithelium	Heavily ciliated epidermal cells covering the outer surface of the pharynx shaft. These are "insunk" epidermal cells in which the nuclei reside behind the layers of longitudinal and circumferential muscles and the epithelial cell body sends out a ciliated projection to the surface to cover and encase the shaft.	ASIN:B000M4NK9M|PMID:29674431						Planarian_Anatomy	https://orcid.org/0000-0003-2569-1939 | https://orcid.org/0000-0002-7535-4784	PLANA:0000016	pharynx	PLANA:0000420|PLANA:0000142	parapharyngeal region|posterior region							PLANA:0000214|PLANA:0004503|PLANA:0004504	juvenile|adult hermaphrodite|asexual adult			PLANA:0000476	pharynx outer longitudinal muscle cell																
PLANA:0000473	pharynx outer circular muscle cell	PLANA:0000473	pharynx outer circular muscle cell	PLANA:0007535	pharynx circular muscle cell	outer circular muscle layer|pharyneal outer circular muscle fiber|pharyngeal outer circular muscle cell|pharynx outer circular muscle fiber	Pharynx muscle fibers thar run circumferentially about the pharynx and lie just beneath the outer longitudinal pharynx muscles.	ASIN:B000M4NK9M|ISBN:9780070316607						Planarian_Anatomy	https://orcid.org/0000-0003-2569-1939 | https://orcid.org/0000-0002-7535-4782			PLANA:0000420|PLANA:0000142	parapharyngeal region|posterior region							PLANA:0004503|PLANA:0000214|PLANA:0004504	adult hermaphrodite|juvenile|asexual adult	PLANA:0000476	pharynx outer longitudinal muscle cell																		
PLANA:0000474	pharynx inner circular muscle cell	PLANA:0000474	pharynx inner circular muscle cell	PLANA:0007535	pharynx circular muscle cell	inner circular muscle layer|pharyngeal inner circular muscle cell|pharyngeal inner circular muscle fiber|pharynx inner circular muscle fiber	Pharynx muscle fiber that runs circumferentially about the pharynx and lies just beneath the inner logitudinal pharynx muscle fibers.	ASIN:B000M4NK9M						Planarian_Anatomy	https://orcid.org/0000-0003-2569-1939 | https://orcid.org/0000-0002-7535-4770			PLANA:0000420|PLANA:0000142	parapharyngeal region|posterior region							PLANA:0004504|PLANA:0004503|PLANA:0000214	asexual adult|adult hermaphrodite|juvenile	PLANA:0007534|PLANA:0007534	inner pharyngeal epithelium|inner pharynx epithelium	PLANA:0000475	pharynx inner longitudinal muscle cell																
PLANA:0000475	pharynx inner longitudinal muscle cell	PLANA:0000475	pharynx inner longitudinal muscle cell	PLANA:0000241	pharynx longitudinal muscle cell	inner longitudinal muscle layer|pharyngeal inner longitudinal muscle cell|pharyngeal inner longitudinal muscle fiber|pharynx inner longitudinal muscle fiber	Pharynx muscle fibers running anteroposterior which lie beneath both the inner circular muscle fibers and the apical, ciliated portion of the epithium lining the lumenal surface.	ASIN:B000M4NK9M|ISBN:9780070316607						Planarian_Anatomy	https://orcid.org/0000-0003-2569-1939 | https://orcid.org/0000-0002-7535-4774	PLANA:0000478	pharynx musculature									PLANA:0000214|PLANA:0004504|PLANA:0004503	juvenile|asexual adult|adult hermaphrodite	PLANA:0000474	pharynx inner circular muscle cell																		
PLANA:0000476	pharynx outer longitudinal muscle cell	PLANA:0000476	pharynx outer longitudinal muscle cell	PLANA:0000241	pharynx longitudinal muscle cell	pharyngeal outer longitudinal muscle cell|pharyngeal outer longitudinal muscle fiber|pharynx outer longitudinal muscle fiber	Pharynx muscle fibers running anteroposterior which lie just underneath the apical, cilaited portion of the outer epithelium.	ASIN:B000M4NK9M						Planarian_Anatomy	https://orcid.org/0000-0003-2569-1939 | https://orcid.org/0000-0002-7535-4786	PLANA:0000478	pharynx musculature									PLANA:0000214|PLANA:0004503|PLANA:0004504	juvenile|adult hermaphrodite|asexual adult	PLANA:0000472	outer pharynx epithelium	PLANA:0000473	pharynx outer circular muscle cell																
PLANA:0000477	pharynx radial muscle cell	PLANA:0000477	pharynx radial muscle cell	PLANA:0000101	muscle cell	pharyngeal radial muscle cell|pharyngeal radial muscle fiber|pharynx radial muscle fiber|radial muscle cell|radial muscle fiber	Pharynx muscle fibers that run radially, connecting the outer muscle fibers and epithelia with their inner counterparts.	ASIN:B000M4NK9M|PMID:28072387						Planarian_Anatomy	https://orcid.org/0000-0003-2569-1939 | https://orcid.org/0000-0002-7535-4794	PLANA:0000478	pharynx musculature	PLANA:0000142|PLANA:0000420	posterior region|parapharyngeal region							PLANA:0004503|PLANA:0004504|PLANA:0000214	adult hermaphrodite|asexual adult|juvenile																				
PLANA:0000478	pharynx musculature	PLANA:0000478	pharynx musculature	PLANA:0000113	tissue 	pharyngeal musculature|pharynx muscle|pharynx musculature	The total musculature within the pharynx.	PMID:26904543|PMID:29674432|SBN:9780070316607|UBERON:0004467						Planarian_Anatomy	https://orcid.org/0000-0003-2569-1939 | https://orcid.org/0000-0002-7535-4779	PLANA:0000428|PLANA:0000016	musculature system|pharynx	PLANA:0000420	parapharyngeal region							PLANA:0004504|PLANA:0000214|PLANA:0004503	asexual adult|juvenile|adult hermaphrodite																				
PLANA:0000479	pharynx inner nerve plexus	PLANA:0000479	pharynx inner nerve plexus	PLANA:0000492	nerve plexus 	inner pharyngeal nerve ring|inner pharynx nerve ring|pharynx inner nerve plexus	Ring of the pharynx nerve plexus that is proximal to the lumen.	ISBN:9780070316607						Planarian_Anatomy	https://orcid.org/0000-0003-2569-1939 | https://orcid.org/0000-0002-7535-4775	PLANA:0000016 | PLANA:0000080	pharynx | peripheral nervous system 	PLANA:0000142|PLANA:0000420	posterior region|parapharyngeal region							PLANA:0004504|PLANA:0004503|PLANA:0000214	asexual adult|adult hermaphrodite|juvenile																				
PLANA:0000480	pharynx outer nerve plexus	PLANA:0000480	pharynx outer nerve plexus	PLANA:0000492	nerve plexus 	outer pharyngeal nerve ring|outer pharynx nerve ring|outer pharynx nerve plexus	Ring of the pharynx nerve plexus that is proximal to the exterior surface.	PMID:27612384|doi:10.1002/jmor.1051550208						Planarian_Anatomy	https://orcid.org/0000-0003-2569-1939 | https://orcid.org/0000-0002-7535-4787	PLANA:0000016 | PLANA:0000080	pharynx | peripheral nervous system	PLANA:0000420|PLANA:0000142	parapharyngeal region|posterior region							PLANA:0004503|PLANA:0000214|PLANA:0004504	adult hermaphrodite|juvenile|asexual adult																				
PLANA:0000481	serotonergic neuron	PLANA:0000481	serotonergic neuron	PLANA:0000556	neurosecretory neuron	serotonergic cell	Neurons that express the neurotransmitter serotonin.	PMID:23903188|PMID:24131630|PMID:24173799|PMID:24922054|PMID:24950970|PMID:25356635|PMID:26525673|PMID:27864883|PMID:28137894|PMID:29357350|PMID:30194301						Planarian_Anatomy	https://orcid.org/0000-0003-2569-1939 | https://orcid.org/0000-0002-7535-4878	PLANA:0000080|PLANA:0000044|PLANA:0000097	peripheral nervous system|cephalic ganglia|ventral nerve cord	PLANA:0000418|PLANA:0004527|PLANA:0000419|PLANA:0000143|PLANA:0000142|PLANA:0000420|PLANA:0000140|PLANA:0000421 | PLANA:0000141	head|copulatory region|prepharyngeal region|ventral region|posterior region|parapharyngeal region|anterior region|tail | dorsal region	PLANA:0007550	serotonergic neural progenitor cell					PLANA:0000214|PLANA:0004504|PLANA:0004503	juvenile|asexual adult|adult hermaphrodite																				
PLANA:0000482	dopaminergic neuron	PLANA:0000482	dopaminergic neuron	PLANA:0000556 |PLANA:0002095	neurosecretory neuron | somatic cell		A neuron that expresses the neurotransmitter dopamine.	PMID:17565705|PMID:21458439|PMID:23250205|PMID:23903188|PMID:24131630|PMID:24173799|PMID:24950970|PMID:25356635|PMID:27864883|PMID:30194301						Planarian_Anatomy	https://orcid.org/0000-0003-2569-1939 | https://orcid.org/0000-0002-7535-4526	PLANA:0000080|PLANA:0000103	peripheral nervous system|central nervous system									PLANA:0004504|PLANA:0000214|PLANA:0004503	asexual adult|juvenile|adult hermaphrodite																				
PLANA:0000483	octopaminergic neuron	PLANA:0000483	octopaminergic neuron	PLANA:0000556	neurosecretory neuron		Neurons that express the biogenic amine octopamine.	PMID:18926867						Planarian_Anatomy	https://orcid.org/0000-0003-2569-1939 | https://orcid.org/0000-0002-7535-4730	PLANA:0000080|PLANA:0000103	peripheral nervous system|central nervous system									PLANA:0004503|PLANA:0000214|PLANA:0004504	adult hermaphrodite|juvenile|asexual adult																				
PLANA:0000484	secretory system	PLANA:0000484	secretory system	PLANA:0000114	anatomical system		Anatomical system that has as its parts cells and glands devoted to the discharge of substances such as mucus.	PMID:20865784						Planarian_Anatomy	https://orcid.org/0000-0003-2569-1939 | https://orcid.org/0000-0002-7535-4872																																
PLANA:0000485	gland cell	PLANA:0000485	gland cell	PLANA:0000100 	epithelial cell 	secretory gland cell	Specialized insunk epithelial cells located in the mesenchyme that participate in mucus secretion. They are characterized by elongated cell bodies with long cytoplasmic projections that terminate between, or penetrate directly throughepithelial cells and form a secretory pore at the surface.	ISBN:9780070316607|PMID:19247960|PMID:20865784|PMID:23318635|PMID:24737865|PMID:28807897|PMID:29674431|PMID:30962434						Planarian_Anatomy	https://orcid.org/0000-0003-2569-1939 | https://orcid.org/0000-0002-7535-4625																																
PLANA:0000486	secretory pore	PLANA:0000486	secretory pore	PLANA:0002079	pore	pore	The opening by which the gland cells secrete mucus to the exterior of the animal.	ISBN:9780070316607|PMID:20865784						Planarian_Anatomy	https://orcid.org/0000-0003-2569-1939 | https://orcid.org/0000-0002-7535-4871											PLANA:0004503|PLANA:0000214|PLANA:0004504	adult hermaphrodite|juvenile|asexual adult																				
PLANA:0000487	acidophilic gland cell	PLANA:0000487	acidophilic gland cell	PLANA:0000485 | PLANA:0002095	gland cell | somatic cell	eosinophilic gland cell|erythrophilous gland cell	One of two distinct histochemical classes of gland cells, these can be found throughout the body but primarily form clusters of subepidermal marginal adhesive glands along the dorsoventral border of the animal.	PMID:20865784						Planarian_Anatomy	https://orcid.org/0000-0003-2569-1939 | https://orcid.org/0000-0002-7535-4408																																
PLANA:0000488	basophilic gland cell	PLANA:0000488	basophilic gland cell	PLANA:0000485 | PLANA:0002095	gland cell | somatic cell	cyanophilic gland cell|cyanophilic secretory cell|cyanophilous gland	One of two distinct histochemical classes of gland cells, these are found near the ventral mesenchyme, the pharynx and in the dorsal region of the head. May also be called cyanophilic gland cells.	ISBN:9780070316607|PMID:20865784|PMID:23405188						Planarian_Anatomy	https://orcid.org/0000-0003-2569-1939 | https://orcid.org/0000-0002-7535-4448																																
PLANA:0000491	plane of autonomy			BSPO:0000400	anatomical plane 		An anatomical plane that bisects a zone of weakness in an appendage. When autotomy occurs, the appendage divides along this plane.	UBERON:0035086						Planarian_Anatomy	https://orcid.org/0000-0003-2569-1939 | https://orcid.org/0000-0002-7535-5001																																
PLANA:0000492	nerve plexus	PLANA:0000492	nerve plexus	PLANA:0000113	tissue	neural network|neural plexus|plexus	Anatomical junction where subdivisions of two or more neural trees interconnect with one another to form a network through which nerve fibers of the constituent nerve trees become regrouped; together with other nerve plexuses, nerves and ganglia, it constitutes the peripheral nervous system. Examples: cervical nerve plexus, brachial nerve plexus, sacral nerve plexus[FMA].	AEO:0000138|BTO:0000205|C12929|EHDAA2:0003138|EHDAA:3780|FMA:5901|ISBN:9780070316607|MA:0002407|PMID:18202849|PMID:24737865|PMID:27612382|PMID:29357350|UBERON:0001810|UMLS:C0501403|http://en.wikipedia.org/wiki/Nervous:system:plexus|http://linkedlifedata.com/resource/umls/id/C0501403|http://www.snomedbrowser.com/Codes/Details/122455009						Planarian_Anatomy	https://orcid.org/0000-0003-2569-1939 | https://orcid.org/0000-0002-7535-4708	PLANA:0000080	peripheral nervous system																														
PLANA:0000493	nervous system commissure	PLANA:0000493	nervous system commissure	PLANA:0000037	definitive tissue	commissure|commissure of neuraxis|neuraxis commissure|white matter commissure	Axon tract that crosses the midline of the central nervous system[NIF, modified]. In the context of Drosophila refers to a broad band of axons connecting equivalent neuropils each side of the brain[FBbt].	C32349|FBbt:00005103|FMA:83906|OpenCyc:Mx4rdBrmE6gOEdudWQACs5b6Bw|TADS:0000201|UBERON:0001020|UMLS:C1185742|http://en.wikipedia.org/wiki/Commissure|http://linkedlifedata.com/resource/umls/id/C1185742|nlx:110|nlx:anat:20090513					*not* the same as FMA:76741 Commissure	Planarian_Anatomy	https://orcid.org/0000-0003-2569-1939 | https://orcid.org/0000-0002-7535-4710	PLANA:0000103	central nervous system																														
PLANA:0000494	brain commissure	PLANA:0000494	brain commissure	PLANA:0002025	commissure		any of the nerve fiber tracts that span the longitudinal fissure between the cerebral and/or cerebellar hemispheres of the brain	UBERON:0005970						Planarian_Anatomy	https://orcid.org/0000-0003-2569-1939 | https://orcid.org/0000-0002-7535-4457	PLANA:0000103|PLANA:0000044	central nervous system|cephalic ganglia	PLANA:0000418|PLANA:0000140|PLANA:0000143	head|anterior region|ventral region																												
PLANA:0000495	blastema			UBERON:0007567	regenerating anatomical structure	regeneration blastema|regenerative blastema	A regenerating tissue composed of a proliferative mass of undifferentiated progenitor cells from which new differentiated structures arise.	PMID:21295481|PMID:24120894|PMID:22451003|PMID:27606067|PMID:26711341|PMID:28807897|https://doi.org/10.1101/279364|PMID:19766622|PMID:28126842|PMID:27612384|PMID:23250205|PMID:20215344|PMID:25772472|PMID:23629965|PMID:24704339|PMID:30297872|PMID:21937596|PMID:15866156|PMID:16033796|PMID:28137894|PMID:20223763|PMID:28216315|PMID:24415944|PMID:22899852|PMID:22439894|PMID:17905225|PMID:18063755|PMID:24173799|PMID:30237141|PMID:17553481|PMID:17670787|PMID:19852954|PMID:26459857|PMID:21664348|PMID:21806978|PMID:18202849|PMID:22411224|PMID:16890156|PMID:19048075|PMID:17251262|PMID:21179478|PMID:22125640|PMID:20599901|PMID:26062938|PMID:20422023|PMID:17942485|PMID:25956527|PMID:28893948|PMID:18456843|PMID:27240733|PMID:20422023|PMID:29291981|PMID:15972844|PMID:27013241|PMID:21356107|PMID:28461239|PMID:30729158|PMID:29291974|PMID:22252539|PMID:23235145|PMID:30194301|PMID:25558068|PMID:22549959|PMID:23405188|PMID:21458439|PMID:19247960|PMID:27068018|PMID:20040488|PMID:22479207|PMID:29273738|PMID:21295483|PMID:24523458|PMID:27612382|PMID:24173799|PMID:22884275|PMID:27542689|PMID:21566195|PMID:28757112|PMID:26525673|PMID:23652002|PMID:29357350|PMID:25725068|PMID:24040508|PMID:26884331|PMID:25254346|PMID:19174194|PMID:30282036|PMID:24922054|PMID:27551436|PMID:22318224|PMID:24063805|PMID:30471994|PMID:23318641|PMID:29158443|PMID:28171748|PMID:30485821						Planarian_Anatomy	https://orcid.org/0000-0003-2569-1939 | https://orcid.org/0000-0002-7535-4975	PLANA:0002133	regenerating fragment																														
PLANA:0000499	cell	PLANA:0000499	cell	UBERON:0000061	anatomical structure		A material entity of anatomical origin (part of or deriving from an organism) that has as its parts a maximally connected cell compartment surrounded by a plasma membrane.	CALOHA:TS-2035|FMA:68646|GO:0005623|KUPO:0000002|VHOG:0001533|WBbt:0004017|XAO:0003012					The definition of cell is intended to represent all cells, and thus a cell is defined as a material entity and not an anatomical structure, which implies that it is part of an organism (or the entirety of one).	Planarian_Anatomy	https://orcid.org/0000-0003-2569-1939 | https://orcid.org/0000-0002-7535-4466																																
