defined_class	defined_class_name	new_entity	new_entity_label	parent_entity	parent_entity_label	exact_syn	defined_class_definition	dbxref	def_dbxref	depictedBy	depicted_by	image_comment	comment	has_obo_namespace	created_by	part_of	part_of_label	contained_in	contained_in_label	develops_from	develops_from_label	existence_starts_during_or_after	existence_starts_during_or_after_label	existence_ends_during_or_before	existence_ends_during_or_before_label	existence_overlaps	existence_overlaps_label	immediately_deep_to	immediately_deep_to_label	immediately_superficial_to	immediately_superficial_to_label	adjacent_to	adjacent_to_label	anterior_to	anterior_to_label	posterior_to	posterior_to_label	participates_in	participates_in_label	produced_by	produced_by_label	produces_this	produces_this_label	specific_to	specific_to_label	results_in 	results_ label 
PLANA:0000090	sperm	PLANA:0000090	sperm	PLANA:0000122|PLANA:0000228	gamete|male germ cell	mature sperm|spermatozoa	A mature male germ cell that develops from a spermatid.	CL:0000019|PMID:17390146|PMID:20844018|PMID:22074376|PMID:25278423|PMID:27149082|PMID:27163480|PMID:27304889|PMID:28072387|PMID:29095551|https://doi.org/10.1101/279364						Planarian_Anatomy	https://orcid.org/0000-0003-2569-1939 | https://orcid.org/0000-0002-7535-4886	PLANA:0000208	testis	PLANA:0000141|PLANA:0004527|PLANA:0000140|PLANA:0000142|PLANA:0000421|PLANA:0000420|PLANA:0000419	dorsal region|copulatory region|anterior region|posterior region|tail|parapharyngeal region|prepharyngeal region	PLANA:0000238	elongate spermatid					PLANA:0004503	adult hermaphrodite													PLANA:0000208	testis			PLANA:0000027	Smed sexual biotype		
PLANA:0000091	sphere formation	PLANA:0000091	sphere formation	PLANA:0000112	Schmidtea mediterranea developmental term		Generation of a multilayered spherical embryo comprised of temporary extraembryonic tissues and undifferentiated blastomeres.	OCLC:20423827|OCLC:464776945|PMID:12888018|PMID:15599763|PMID:28072387						Planarian_Anatomy	https://orcid.org/0000-0003-2569-1939 | https://orcid.org/0000-0002-7535-4896							PLANA:0000002	Stage 2	PLANA:0000002	Stage 2	PLANA:0000002	Stage 2																				
PLANA:0000092	yolk syncytium	PLANA:0000092	yolk syncytium	PLANA:0002136	syncytium	syncytial yolk cell	Fused yolk cells surrounding blastomeres undergoing dispersed cleavage during Stages 1 and 2.	PMID:15599763						Planarian_Anatomy	https://orcid.org/0000-0003-2569-1939 | https://orcid.org/0000-0002-7535-4969							PLANA:0000001	Stage 1	PLANA:0000002	Stage 2	PLANA:0000002|PLANA:0000001	Stage 2|Stage 1													PLANA:0000107	yolk cell			PLANA:0000116|PLANA:0000027	embryo|Smed sexual biotype		
PLANA:0000093	tertiary gut branch	PLANA:0000093	tertiary gut branch	PLANA:0002119	gut branch	tertiary branch|tertiary intestinal branch	Gut branches originating from and connected to the secondary gut branches.	PMID:21664348|PMID:23250205|PMID:27122174|PMID:28137894|PMID:28287248|PMID:30194301|PMID:30471994			http://purl.obolibrary.org/obo/plana/images/tertiarygutbranch.png	Depicted by field contains hematoxylin and eosin staining section of a asexual adult animal. The tertiary gut branch indicated is by arrows. Scale bar = 250um		Planarian_Anatomy	https://orcid.org/0000-0003-2569-1939 | https://orcid.org/0000-0002-7535-4927																																
PLANA:0000095	trail cell	PLANA:0000095	trail cell	PLANA:0000429	neoblast	eye progenitor|eye progenitor cell|ovo+ eye progenitor	Ovo+ neoblasts and post-mitotic eye progenitors that simultaneously migrate and differentiate into photoreceptor neurons and non-neuronal pigment cup cells comprising the optic cup.	PMID:21852957|PMID:22884275|PMID:23250205|PMID:24040508|PMID:27606067|PMID:28072387|PMID:28245923|PMID:29674431|PMID:30485821						Planarian_Anatomy	https://orcid.org/0000-0003-2569-1939 | https://orcid.org/0000-0002-7535-4940	PLANA:0000124	visual system	PLANA:0000418|PLANA:0000141|PLANA:0000140	head|dorsal region|anterior region 			PLANA:0000006	Stage 6			PLANA:0000008|PLANA:0000006|PLANA:0004504|PLANA:0000214|PLANA:0000007|PLANA:0004503	Stage 8|Stage 6|asexual adult|juvenile|Stage 7|adult hermaphrodite																				
PLANA:0000096	ventral epidermis	PLANA:0000096	ventral epidermis				Single cell layer of ventral, post-mitotic, heavily ciliated epithelial cells			Don't Edit here. Edit in anatomicalSpaceLocatedInAnatomicalEntity.tsv tab				Planarian_Anatomy	https://orcid.org/0000-0003-2569-1939 | https://orcid.org/0000-0002-7535-4950																																
PLANA:0000097	ventral nerve cord	PLANA:0000097	ventral nerve cord	PLANA:0000431	organ	VNC|nerve cord|ventral cord	The pair of closely united ventral longitudinal nerves with their segmental ganglia that is characteristic of many elongate invertebrates (as earthworms)[BTO]. A large process bundle that runs along the vental mid-line extending from the ventral region of the nerve ring[WB]. The ventral cord is one of the distinguishing traits of the central nervous system of all arthropods (such as insects, crustaceans and arachnids) as well as many other invertebrates, such as the annelid worms[GO].	BTO:0002328|EFO:0000896|FBbt:00001102|ISBN:9780070316607|MAT:0000339|MIAA:0000339|PMID:16033796|PMID:16890156|PMID:17251262|PMID:17390146|PMID:17553481|PMID:17905225|PMID:18063755|PMID:18063757|PMID:18202849|PMID:18287199|PMID:19174194|PMID:19211673|PMID:19247960|PMID:20215344|PMID:20223763|PMID:20422023|PMID:20599901|PMID:20707997|PMID:20967238|PMID:21179478|PMID:21282632|PMID:21566185|PMID:21806978|PMID:21828097|PMID:22074376|PMID:22125640|PMID:22339734|PMID:22479207|PMID:23250205|PMID:23297191|PMID:23318635|PMID:23954785|PMID:24063805|PMID:24120894|PMID:24131630|PMID:24173799|PMID:24950970|PMID:25254346|PMID:25356635|PMID:25558068|PMID:25772472|PMID:25956527|PMID:26017970|PMID:26062938|PMID:26457503|PMID:26556349|PMID:27013241|PMID:27034770|PMID:27150006|PMID:27163480|PMID:27612382|PMID:28072387|PMID:28126842|PMID:28245923|PMID:28807897|PMID:29291974|PMID:29674431|PMID:30143032|PMID:30471994|UBERON:0000934|WBbt:0005829|http://en.wikipedia.org/wiki/Ventral:nerve:cord|nlx:146329						Planarian_Anatomy	https://orcid.org/0000-0003-2569-1939 | https://orcid.org/0000-0002-7535-4954	PLANA:0000103	central nervous system	PLANA:0000420|PLANA:0000418|PLANA:0000143|PLANA:0000140|PLANA:0004527|PLANA:0000142|PLANA:0000419|PLANA:0000421	parapharyngeal region|head|ventral region|anterior region|copulatory region|posterior region|prepharyngeal region|tail							PLANA:0000007|PLANA:0000214|PLANA:0004504|PLANA:0000008|PLANA:0004503	Stage 7|juvenile|asexual adult|Stage 8|adult hermaphrodite																				
PLANA:0000098	zygote	PLANA:0000098	zygote	UBERON:0000068	embryo stage		Diploid cell resulting from the fusion of male and female gametes at fertilization. [The_Dictionary_of_Cell_and_Molecular_Biology:Third_Edition ]. 	BTO:0000854|PMID:28812561						Planarian_Anatomy	https://orcid.org/0000-0003-2569-1939 | https://orcid.org/0000-0002-7535-4971							PLANA:0000001	Stage 1	PLANA:0000001	Stage 1	PLANA:0000001	Stage 1																	PLANA:0000027	Smed sexual biotype		
PLANA:0000099	neuron	PLANA:0000099	neuron	PLANA:0000540 |PLANA:0002095	electrically signaling cell | somatic cell	differentiated neuron|nerve cell|neural cell|neuronal cell	The basic cellular unit of nervous tissue. Each neuron consists of a body, an axon, and dendrites. Their purpose is to receive, conduct, and transmit impulses in the nervous system.	CL:0000540|PMID:16033796|PMID:16890156|PMID:17553481|PMID:17905225|PMID:18202849|PMID:18287199|PMID:19048075|PMID:19174194|PMID:19211673|PMID:20215344|PMID:21566185|PMID:22411224|PMID:22439894|PMID:22479207|PMID:22549959|PMID:23297191|PMID:23903188|PMID:23954785|PMID:24040508|PMID:24131630|PMID:24173799|PMID:24737865|PMID:24922054|PMID:24950970|PMID:25254346|PMID:25356635|PMID:25558068|PMID:26457503|PMID:26525673|PMID:27013241|PMID:27063937|PMID:27150006|PMID:27163480|PMID:27542689|PMID:27612382|PMID:27612384|PMID:27864883|PMID:28072387|PMID:28126842|PMID:28137894|PMID:28245923|PMID:28292427|PMID:28461239|PMID:28807897|PMID:29100657|PMID:29184198|PMID:29291974|PMID:29291981|PMID:29357350|PMID:29674432|PMID:30143032|PMID:30399335						Planarian_Anatomy	https://orcid.org/0000-0003-2569-1939 | https://orcid.org/0000-0002-7535-4713																																
PLANA:0000100	epithelial cell	PLANA:0000100	epithelial cell	PLANA:0000119 | PLANA:0002095	terminally differentiated cell | somatic cell	epidermis cell	A cell that is usually found in a two-dimensional sheet with a free surface. The cell has a cytoskeleton that allows for tight cell to cell contact and for cell polarity where the apical part is directed towards the lumen and the basal part to the basal lamina.	CL:0000066|PMID:18202849|PMID:19048075|PMID:20865784|PMID:22479207|PMID:24737865|PMID:26114597|PMID:28072387|PMID:28461239						Planarian_Anatomy	https://orcid.org/0000-0003-2569-1939 | https://orcid.org/0000-0002-7535-4570																																
PLANA:0000101	muscle cell	PLANA:0000101	muscle cell	PLANA:0000539 | PLANA:0002095	electrically responsive cell | somatic cell	muscle fiber|myocyte	A mature contractile cell, commonly known as a myocyte. This cell has as part of its cytoplasm myofibrils organized in various patterns.	CL:0000187|PMID:15972844|PMID:18202849|PMID:19174194|PMID:20422023|PMID:20511647|PMID:21458439|PMID:21828097|PMID:22252539|PMID:22479207|PMID:23318641|PMID:23405188|PMID:23954785|PMID:24415944|PMID:24737865|PMID:25254346|PMID:25558068|PMID:26062938|PMID:27063937|PMID:27523733|PMID:28216315|PMID:28287248|PMID:28292427|PMID:28461239|PMID:28686611|PMID:28807897|PMID:28893948|PMID:30471994|PMID:30962434						Planarian_Anatomy	https://orcid.org/0000-0003-2569-1939 | https://orcid.org/0000-0002-7535-4702																																
PLANA:0000102	anatomical region	PLANA:0000102	anatomical region	UBERON:0000475	organism subdivision	body region	A subdivision of an anatomical compartment.	PMID:28292427|PMID:29547123						Planarian_Anatomy	https://orcid.org/0000-0003-2569-1939 | https://orcid.org/0000-0002-7535-4423																																
PLANA:0000103	central nervous system	PLANA:0000103	central nervous system	PLANA:0000025	nervous system	CNS|head-restricted nervous system	The central nervous system is the core nervous system that serves an integrating and coordinating function. In vertebrates it consists of the neural tube derivatives: the brain and spinal cord. In invertebrates it includes central ganglia plus nerve cord.	PMID:16033796|PMID:16344473|PMID:16890156|PMID:17251262|PMID:17553481|PMID:17670787|PMID:17905225|PMID:17942485|PMID:18063757|PMID:18202849|PMID:18287199|PMID:19174194|PMID:19247960|PMID:19933103|PMID:20865784|PMID:20967238|PMID:21282632|PMID:21295481|PMID:21458439|PMID:21664348|PMID:21806978|PMID:21828097|PMID:22125640|PMID:22252539|PMID:22339734|PMID:22385657|PMID:22411224|PMID:22427692|PMID:22439894|PMID:22445864|PMID:23297191|PMID:23318635|PMID:23318641|PMID:23903188|PMID:24063805|PMID:24173799|PMID:24367277|PMID:24704339|PMID:24737865|PMID:24922054|PMID:24950970|PMID:25356635|PMID:25493551|PMID:25772472|PMID:25956527|PMID:26017970|PMID:26459857|PMID:26711341|PMID:26884331|PMID:27013241|PMID:27063937|PMID:27068018|PMID:27074666|PMID:27150006|PMID:27163480|PMID:27240733|PMID:27523733|PMID:27542689|PMID:27612382|PMID:27612384|PMID:27800171|PMID:27864883|PMID:28126842|PMID:28434803|PMID:28461239|PMID:28807897|PMID:28976975|PMID:29273738|PMID:29291981|PMID:30399335|PMID:30471994|PMID:30729158|PMID:30962434|UBERON:0001017|https://doi.org/10.1101/279364						Planarian_Anatomy	https://orcid.org/0000-0003-2569-1939 | https://orcid.org/0000-0002-7535-4475																																
PLANA:0000104	rhabdite	PLANA:0000104	rhabdite	PLANA:0000430	epithelial cell component		Straight or curved rod-like structures within the epidermal cells, oriented with long axis at right angles to the epidermal surface, that are discharged into mucous secretions.	OCLC:16809160						Planarian_Anatomy	https://orcid.org/0000-0003-2569-1939 | https://orcid.org/0000-0002-7535-4853																																
PLANA:0000105	secretory cell	PLANA:0000105	secretory cell	PLANA:0000119	terminally differentiated cell		A cell that specializes in controlled release of one or more substances.	CL:0000151						Planarian_Anatomy	https://orcid.org/0000-0003-2569-1939 | https://orcid.org/0000-0002-7535-4868																																
PLANA:0000106	ciliated epithelial cell	PLANA:0000106	ciliated epithelial cell	PLANA:0000100	epithelial cell 	ciliated epidermal cell	An epithelial cell that has cilia.	CL:0000067|PMID:24737865|PMID:28461239|PMID:28807897						Planarian_Anatomy	https://orcid.org/0000-0003-2569-1939 | https://orcid.org/0000-0002-7535-4493																																
PLANA:0000107	yolk cell	PLANA:0000107	yolk cell	PLANA:0000119|PLANA:0000215	terminally differentiated cell|reproductive system product	vitellocyte	An extraembryonic cell, produced by somatic vitellogenic glands in adult hermaphrodites, that provides nutrition to the developing embryo.	CL:0000428|ISBN:9780070316607|PMID:22074376|PMID:27149082|PMID:28072387|PMID:28434803|PMID:29674431						Planarian_Anatomy	https://orcid.org/0000-0003-2569-1939 | https://orcid.org/0000-0002-7535-4968	PLANA:0000060	embryonic wall	PLANA:0000419|PLANA:0000421|PLANA:0000142|PLANA:0000140|PLANA:0000420|PLANA:0004527|PLANA:0000143|PLANA:0000141	prepharyngeal region|tail|posterior region|anterior region|parapharyngeal region|copulatory region|ventral region|dorsal region			PLANA:0000214	juvenile			PLANA:0004503|PLANA:0000214	adult hermaphrodite|juvenile													PLANA:0000231	vitelline gland			PLANA:0000027	Smed sexual biotype		
PLANA:0000109	anatomical compartment subdivision feature	PLANA:0000109	anatomical compartment subdivision feature	PLANA:0000417	definitive organism subdivision		Feature of an organism that is a subdivision of a local region. For example, the anterior pole is a subdivision of the head.							Planarian_Anatomy	https://orcid.org/0000-0003-2569-1939 | https://orcid.org/0000-0002-7535-4424																																
PLANA:0000110	pharynx progenitor cell	PLANA:0000110	pharynx progenitor cell				foxA1+ neoblasts and their post-mitotic, differentiating daughters required for maintenance and regeneration of the pharynx.			Don't Edit here. Edit in progenitorCellTypes.tsv tab				Planarian_Anatomy	https://orcid.org/0000-0003-2569-1939 | https://orcid.org/0000-0002-7535-4512																																
PLANA:0000111	proximal tubule epithelial cell	PLANA:0000111	proximal tubule epithelial cell	PLANA:0000106	ciliated epithelial cell	proximal tubule cell	Ciliated epithelial cells that assemble into proximal tubules.	PMID:21828097|PMID:29674431						Planarian_Anatomy	https://orcid.org/0000-0003-2569-1939 | https://orcid.org/0000-0002-7535-4841	PLANA:0000087	proximal tubule	PLANA:0000140|PLANA:0000142|PLANA:0000141|PLANA:0000420|PLANA:0004527|PLANA:0000421|PLANA:0000418|PLANA:0000419	anterior region|posterior region|dorsal region|parapharyngeal region|copulatory region|tail|head|prepharyngeal region							PLANA:0004503|PLANA:0000214|PLANA:0004504	adult hermaphrodite|juvenile|asexual adult																				
PLANA:0000112	Schmidtea mediterranea developmental term	PLANA:0000112	Schmidtea mediterranea developmental term	owl:Thing	owl:Thing		A term used to describe a developmental process during Schmidtea mediterranea embryogenesis.	https://github.com/obophenotype/planaria-ontology/blob/master/metadata/planarefs/planaref-0000000.md						Planarian_Anatomy	https://orcid.org/0000-0003-2569-1939 | https://orcid.org/0000-0002-7535-4866																																
PLANA:0000113	tissue	PLANA:0000113	tissue	PLANA:0000427	multicellular anatomical structure		Multicellular anatomical structure that consists of many cells of one or a few types, arranged in an extracellular matrix such that their long-range organisation is at least partly a repetition of their short-range organisation.	UBERON:0000479|https://github.com/obophenotype/planaria-ontology/blob/master/metadata/planarefs/planaref-0000000.md						Planarian_Anatomy	https://orcid.org/0000-0003-2569-1939 | https://orcid.org/0000-0002-7535-4939																																
PLANA:0000114	anatomical system	PLANA:0000114	anatomical system	PLANA:0000427	multicellular anatomical structure		Multicellular, connected anatomical structure that has multiple organs as parts and whose parts work together to achieve some shared function.	UBERON:0000467						Planarian_Anatomy	https://orcid.org/0000-0003-2569-1939 | https://orcid.org/0000-0002-7535-4425																																
PLANA:0000115	distal tubule epithelial cell	PLANA:0000115	distal tubule epithelial cell	PLANA:0000015 |PLANA:0002095	non ciliated epithelial cell | somatic cell	distal tubule cell	Nonciliated epithelial cells that assemble into protonephridial distal tubules.	PMID:21828097|PMID:29674431				Depicted by field contains a diagram representing the protonephrida unit (top) as well as a 3D rendering of confocal data depicting the same. In the diagram, terminal flame cells and their corresponding cilia are in blues, the proximal tubule is in reds, the distal tubule is in greens while thecollecting duct is in purple. In the 3D rendering below the cilia (AcTub) are in blue, portions of the proximal tubule (slc6a-13) are in red while the distal tubule (slc6a-12) is in green.		Planarian_Anatomy	https://orcid.org/0000-0003-2569-1939 | https://orcid.org/0000-0002-7535-4525	PLANA:0000053	distal tubule	PLANA:0000418|PLANA:0000420|PLANA:0000142|PLANA:0000421|PLANA:0000141|PLANA:0000419|PLANA:0000140|PLANA:0004527	head|parapharyngeal region|posterior region|tail|dorsal region|prepharyngeal region|anterior region|copulatory region							PLANA:0004503|PLANA:0000214|PLANA:0004504	adult hermaphrodite|juvenile|asexual adult																				
PLANA:0000116	embryo	PLANA:0000116	embryo	PLANA:0000215	reproductive system product		Anatomical entity that comprises the organism in the early stages of growth and differentiation that are characterized by cleavage, the laying down of fundamental tissues, and the formation of primitive organs and organ systems. For example, for mammals, the process would begin with zygote formation and end with birth. For insects, the process would begin at zygote formation and end with larval hatching. For plant zygotic embryos, this would be from zygote formation to the end of seed dormancy. For plant vegetative embryos, this would be from the initial determination of the cell or group of cells to form an embryo until the point when the embryo becomes independent of the parent plant.	UBERON:0000922						Planarian_Anatomy	https://orcid.org/0000-0003-2569-1939 | https://orcid.org/0000-0002-7535-4545																													PLANA:0000027	Smed sexual biotype		
PLANA:0000117	embryonic structure	PLANA:0000117	embryonic structure	UBERON:0005423	developing anatomical structure		Anatomical structure that is part of an embryo.	UBERON:0002050						Planarian_Anatomy	https://orcid.org/0000-0003-2569-1939 | https://orcid.org/0000-0002-7535-4559																																
PLANA:0000118	collecting duct epithelial cell	PLANA:0000118	collecting duct epithelial cell	PLANA:0000015 | PLANA:0002095	non ciliated epithelial cell | somatic cell		Nonciliated epithelial cells that assemble into collecting ducts.	PMID:26057828						Planarian_Anatomy	https://orcid.org/0000-0003-2569-1939 | https://orcid.org/0000-0002-7535-4501	PLANA:0000047	collecting duct	PLANA:0000142|PLANA:0000141|PLANA:0000421|PLANA:0000140|PLANA:0000418|PLANA:0004527|PLANA:0000419|PLANA:0000420	posterior region|dorsal region|tail|anterior region|head|copulatory region|prepharyngeal region|parapharyngeal region							PLANA:0004503|PLANA:0000214|PLANA:0004504	adult hermaphrodite|juvenile|asexual adult																				
PLANA:0000119	terminally differentiated cell	PLANA:0000119	terminally differentiated cell	PLANA:0000499 | PLANA:0002095	cell | somatic cell		A post-mitotic, terminally differentiated cell type found in planarian embryos, juveniles and/or adult animals.	PMID:29674432						Planarian_Anatomy	https://orcid.org/0000-0003-2569-1939 | https://orcid.org/0000-0002-7535-4926																																
PLANA:0000120	progenitor cell	PLANA:0000120	progenitor cell	PLANA:0000499	cell	precursor cell	A cycling neoblast and/or post-mitotic cell that is primed or irreversibly committed to a tissue-specific differentation program	PMID:21852957|PMID:29674432|https://doi.org/10.1101/279364						Planarian_Anatomy	https://orcid.org/0000-0003-2569-1939 | https://orcid.org/0000-0002-7535-4829																																
PLANA:0000121	stem cell	PLANA:0000121	stem cell	PLANA:0000499	cell		A relatively undifferentiated cell that retains the ability to divide and proliferate throughout life to provide progenitor cells that can differentiate into specialized cells.	CL:0000034|PMID:17376870|PMID:19805089|PMID:20422023|PMID:20707997|PMID:21937596|PMID:22385657|PMID:23123964|PMID:23318635|PMID:24063805|PMID:24173799|PMID:26062938|PMID:26651295|PMID:26711341|PMID:27013241|PMID:27034770|PMID:27501047|PMID:29124009|https://doi.org/10.1101/279364						Planarian_Anatomy	https://orcid.org/0000-0003-2569-1939 | https://orcid.org/0000-0002-7535-4906																																
PLANA:0000122	gamete	PLANA:0000122	gamete	PLANA:0000227|PLANA:0000215	germ cell|reproductive system product		A mature sexual reproductive cell having a single set of unpaired chromosomes.	CL:0000300|PMID:20844018|PMID:23652002|PMID:27149082|PMID:27163480|PMID:27304889|PMID:28434803						Planarian_Anatomy	https://orcid.org/0000-0003-2569-1939 | https://orcid.org/0000-0002-7535-4611							PLANA:0000214	juvenile			PLANA:0004503|PLANA:0000214	adult hermaphrodite|juvenile													PLANA:0000217	gonad			PLANA:0000027	Smed sexual biotype		
PLANA:0000123	embryonic cell	PLANA:0000123	embryonic cell	PLANA:0000499	cell		A cell of the embryo.	CL:0002321						Planarian_Anatomy	https://orcid.org/0000-0003-2569-1939 | https://orcid.org/0000-0002-7535-4546																													PLANA:0000027|PLANA:0000116	Smed sexual biotype|embryo		
PLANA:0000124	visual system	PLANA:0000124	visual system	PLANA:0000114	anatomical system		The sensory system subserving the sense of vision.	UBERON:0002104						Planarian_Anatomy	https://orcid.org/0000-0003-2569-1939 | https://orcid.org/0000-0002-7535-4957																																
PLANA:0000125	sensory system	PLANA:0000125	sensory system	PLANA:0000114	anatomical system		Anatomical system that overlaps the nervous system and is responsible for receiving and processing sensory information.	UBERON:0001032						Planarian_Anatomy	https://orcid.org/0000-0003-2569-1939 | https://orcid.org/0000-0002-7535-4876																																
PLANA:0000126	reproductive system	PLANA:0000126	reproductive system	PLANA:0000114	anatomical system		Anatomical system that has as its parts the organs concerned with reproduction.	UBERON:0000990						Planarian_Anatomy	https://orcid.org/0000-0003-2569-1939 | https://orcid.org/0000-0002-7535-4851																													PLANA:0000027	Smed sexual biotype		
PLANA:0000127	oviduct epithelial cell	PLANA:0000127	oviduct epithelial cell	PLANA:0000106	ciliated epithelial cell		Ciliated epithelial cells that assemble into the oviduct.	PMID:22074376						Planarian_Anatomy	https://orcid.org/0000-0003-2569-1939 | https://orcid.org/0000-0002-7535-4749	PLANA:0004532	oviduct epithelium	PLANA:0000140|PLANA:0000420|PLANA:0000143|PLANA:0004527|PLANA:0000419|PLANA:0000142	anterior region|parapharyngeal region|ventral region|copulatory region|prepharyngeal region|posterior region			PLANA:0000214	juvenile			PLANA:0004503|PLANA:0000214	adult hermaphrodite|juvenile																	PLANA:0000027	Smed sexual biotype		
PLANA:0000128	sperm duct epithelial cell	PLANA:0000128	sperm duct epithelial cell	PLANA:0000106	ciliated epithelial cell		Ciliated epithelial cells comprising the sperm ducts.	PMID:19022767|PMID:22074376						Planarian_Anatomy	https://orcid.org/0000-0003-2569-1939 | https://orcid.org/0000-0002-7535-4888	PLANA:0004533	sperm duct epithelium	PLANA:0004527|PLANA:0000141|PLANA:0000421|PLANA:0000419|PLANA:0000142|PLANA:0000140|PLANA:0000420	copulatory region|dorsal region|tail|prepharyngeal region|posterior regionl|anterior region|parapharyngeal region			PLANA:0000214	juvenile			PLANA:0004503|PLANA:0000214	adult hermaphrodite|juvenile																	PLANA:0000027	Smed sexual biotype		
PLANA:0000130	circular muscle progenitor cell	PLANA:0000130	circular muscle progenitor cell	PLANA:0000019|PLANA:0000429 | PLANA:0002095	muscle progenitor cell|neoblast | somatic cell		piwi-1+, nkx1-1+ progenitor neoblasts required for specification of circular muscle fibers.	PMID:29168507						Planarian_Anatomy	https://orcid.org/0000-0003-2569-1939 | https://orcid.org/0000-0002-7535-4498	PLANA:0000428	musculature system	PLANA:0000420|PLANA:0000143|PLANA:0004527|PLANA:0000141|PLANA:0000419|PLANA:0000421|PLANA:0000418|PLANA:0000142|PLANA:0000140	parapharyngeal region|ventral region|copulatory region|dorsal region|prepharyngeal region|tail|head|posterior region|anterior region							PLANA:0004504|PLANA:0004503|PLANA:0000214	asexual adult|adult hermaphrodite|juvenile																				
PLANA:0000131	primordium	PLANA:0000131	primordium	UBERON:0007567	regenerating anatomical structure		Primordia are populations of contiguous cells that are morphologically distinct and already correspond in extent to a later organ/tissue.	UBERON:0001048						Planarian_Anatomy	https://orcid.org/0000-0003-2569-1939 | https://orcid.org/0000-0002-7535-4827																																
